{"$id":"https://schemas.mengxia.local/plugin/manifest-v1.schema.json","$schema":"https://json-schema.org/draft/2020-12/schema","additionalProperties":false,"properties":{"$schema":{"const":"https://schemas.mengxia.local/plugin/manifest-v1.schema.json"},"capabilities":{"items":{"pattern":"^[a-z][a-z0-9_]*(\\.[a-z][a-z0-9_]*){1,7}@[1-9][0-9]*$","type":"string"},"maxItems":64,"type":"array","uniqueItems":true},"manifest_version":{"const":1},"plugin_id":{"maxLength":128,"minLength":1,"pattern":"^[a-z][a-z0-9._-]*$","type":"string"},"publisher":{"maxLength":128,"minLength":1,"pattern":"^[A-Za-z0-9._-]+$","type":"string"},"requested_permissions":{"items":{"additionalProperties":false,"properties":{"kind":{"const":"broker.asset.read@1"},"scope":{"const":"run-inputs"}},"required":["kind","scope"],"type":"object"},"maxItems":1,"type":"array","uniqueItems":true},"runtime_dependencies":{"items":{"additionalProperties":false,"properties":{"byte_length":{"maximum":1073741824,"minimum":1,"type":"integer"},"dependency_id":{"maxLength":64,"minLength":1,"pattern":"^[a-z][a-z0-9_-]*$","type":"string"},"role":{"enum":["PLUGIN_ENTRYPOINT","TOOL"]},"sha256":{"pattern":"^[0-9a-f]{64}$","type":"string"},"target":{"const":"aarch64-apple-darwin"}},"required":["byte_length","dependency_id","role","sha256","target"],"type":"object"},"maxItems":32,"minItems":1,"type":"array"},"version":{"maxLength":64,"minLength":1,"type":"string"}},"required":["$schema","capabilities","manifest_version","plugin_id","publisher","requested_permissions","runtime_dependencies","version"],"title":"MengXia Plugin Manifest V1","type":"object"}
