{"$schema":"https://schemas.mengxia.local/plugin/manifest-v1.schema.json","capabilities":["media.video.image_to_video@1"],"manifest_version":1,"plugin_id":"example.transcoder","publisher":"example-untrusted-label","requested_permissions":[{"kind":"broker.asset.read@1","scope":"run-inputs"}],"runtime_dependencies":[{"byte_length":1234,"dependency_id":"entrypoint","role":"PLUGIN_ENTRYPOINT","sha256":"1111111111111111111111111111111111111111111111111111111111111111","target":"aarch64-apple-darwin"}],"version":"1.0.0"}